job_title,company,location,link,skills
Staff Software Developer,WELL Health Technologies Corp,"Toronto, ON",https://www.workopolis.com/jobsearch/viewjob/pP83O_nA8bEoDhig-ErB5EhLMxp6wbljsC7yx2SwF1qyLDaAee-Qmn_ETZuANSNb,"Microsoft Excel, Azure, Node.js, JUnit, Electronic medical records, React, Full-stack development, Git, Java, SQL, JavaScript, Angular, EMR systems, Software development, Unit testing, Spring, Hibernate, MySQL"
Software Developer,Discovered Intelligence,"Toronto, ON",https://www.workopolis.com/jobsearch/viewjob/D3mzPSzKzsJ_q16uBBRRPD29xcQw4shmLf5ohCcdb4OHj2UQrnjUeK8kaousGznu,
Software Developer (Content Trust Team),Loopio,"Toronto, ON",https://www.workopolis.com/jobsearch/viewjob/qFDXuonBViLUYogwKJGJsukkl24G9S1wEHf1Gc_J7Af66BJT0iV6I7-WJwCmiIK6,
Senior Software Developer,WELL Health Technologies Corp,"Toronto, ON",https://www.workopolis.com/jobsearch/viewjob/CYcDnyKPxWuKkaJlrbcshzZpZ07ib_AvC-D4rG0ITwSFnyrD23es-V4qs_vn8X33,"Microsoft Excel, Azure, Node.js, JUnit, Electronic medical records, React, Full-stack development, Git, Java, SQL, JavaScript, Angular, EMR systems, Software development, Unit testing, Spring, Hibernate, MySQL"
"Typescript, Backstage.io Developer",Atlantis IT group,"Toronto, ON",https://www.workopolis.com/jobsearch/viewjob/Y1LKMOz8olnK9yUw126fe85Tsg7OUoI9HSlKi8ueV2MoZ64NWKJE5WYZPYgrZgBB,"Node.js, React, Web development, JavaScript, APIs, GraphQL, TypeScript"
software developer,G9SIGMA INC.,"Toronto, ON",https://www.workopolis.com/jobsearch/viewjob/WmfSNIrkaGAQxKb0CnF_pOlcgUPp4If6NMnqXBtolO50ZKXqG91bZkncNJiz25Of,"AJAX, CSS, React, Git, English, Windows, .NET, Java, SQL, OOP, Bachelor's, JavaScript, JSP, Angular, SharePoint, Computer skills, Eclipse, Groovy, Communication skills, Python, React Native, Shell Scripting, jQuery, HTML5, MySQL"
Java Developer,HANKER SYSTEMS PRIVATE LIMITE,"Toronto, ON",https://www.workopolis.com/jobsearch/viewjob/HNCo1dMo0ERdbQsnpmakoDXK7fQFjlvblCVEsK7tCqBnz2ZqSmK7UKUnZu8G-myg,"CI/CD, Oracle, Cassandra, React, Web development, DB2, UNIX, Git, MongoDB, Java, OOP, Bachelor's, Angular, Linux, Spring, Hibernate"
Senior Java Script Developer,AstraNorth,"Toronto, ON",https://www.workopolis.com/jobsearch/viewjob/X4PeaYDRzUEKb5jmHi7wZOBwH1HIfftSjrDsEJh76pByYh4Ii0wIcnvuhgSTX-DB,"CI/CD, Oracle, Cassandra, React, Web development, DB2, UNIX, Git, MongoDB, Java, OOP, JavaScript, Angular, Linux, Spring, Hibernate"
Software Engineer,Morningstar,"Toronto, ON",https://www.workopolis.com/jobsearch/viewjob/gZD7MOp3W8ges58P5CvW79UUezctZuGhcsgU4JJ3KXzmY0kEJM3aO5RhwxjEMNxB,"Spring Boot, Node.js, CSS, React, Full-stack development, Microsoft SQL Server, Java, Databases, SQL, AWS, JavaScript, PostgreSQL, Angular, Organizational skills, APIs, Financial services, Communication skills, HTML5, MySQL"
"Senior Full Stack Developer, FE",Intuit,"Toronto, ON",https://www.workopolis.com/jobsearch/viewjob/OiAu99zx0ZAD0PQDmaQO2E6K-ZhPxEwcA4yrljCRvpyuGJQlH7ieTegNZ8SvI0eV,"Microsoft Powerpoint, CI/CD, Node.js, Computer Science, CSS, React, Kubernetes, Big data, Mobile applications, Test-driven development, SOAP, AWS, Bachelor's, JavaScript, REST, Scrum, Software development, Agile, Web services, Unit testing, Marketing, HTML5, SDLC"
Senior Fullstack Software Developer (Node. JS & React),Lightspeed,"Toronto, ON",https://www.workopolis.com/jobsearch/viewjob/iWRGergbO-veL_42sWMkLzxoi-BtlCdBae9TF02By0DXdyWFcrCcH0wRKCQvJnF6,
Hiring for a Full-Time Position at Kumaran Systems for a Python Developer- Toronto Location,Kumaran Systems Pvt Ltd,"Toronto, ON",https://www.workopolis.com/jobsearch/viewjob/YRXGIEXVxhAKIiaHZ_FJqREvwfBsXSfX-eccTsl6I4C9Fx6_LGJ_wzS0A2IvJo_s,"TensorFlow, Azure, React, Kubernetes, PyTorch, UNIX, OOP, JavaScript, Natural language processing, Angular, APIs, Keras, AI, Leadership, Communication skills, Python, Shell Scripting, HTML5, Design patterns"
Programmer Analyst Advisory - React.js,Scotiabank,"Toronto, ON",https://www.workopolis.com/jobsearch/viewjob/yRo9sZ6QM0zER59UExqoV1CZqJx2WsctQGbeDNt7Y0UauWt3LzVV8UFtnzXlD5l7,
Software Developer Front End 7657-0810,Foilcon,"Toronto, ON",https://www.workopolis.com/jobsearch/viewjob/rx87FAa3fcCD2eZXmG7VT6XUtA1AFa-Mpmt6FSRAMi7mKKwA1ZiaBy7o8_B0XIOP,"Web accessibility, AJAX, ASP.NET, Azure, CSS, React, Web development, Social media management, Relational databases, Writing skills, DevOps, .NET Core, C#, Git, Application development, Databases, SOAP, SQL, JavaScript, SCSS, SASS, REST, Angular, SharePoint, Software development, APIs, UI, TypeScript, Communication skills, Information management, Python, jQuery, Negotiation, Debugging, HTML5, SDLC"
Sr. Software Developer,Propel Holding Inc,"Toronto, ON",https://www.workopolis.com/jobsearch/viewjob/Oz0r_B_UFfX2uasXy1u1UR42I7paaRsXzXq58G3bo4foOFbxgrUbMKnRygT2zfqF,
Full Stack Developer,AtkinsRéalis,"Mississauga, ON",https://www.workopolis.com/jobsearch/viewjob/rfT8Tmd5IAMOnJ17wZebHZl15TXjFOKbOPKyrFZbTdEBYljk6vfICysqOoOi1wfh,"Node.js, Computer Science, CSS, React, XML, Full-stack development, DevOps, Mobile applications, Engineering, C#, MongoDB, UI design, Java, Application development, Databases, Cloud development, JavaScript, Angular, Organizational skills, APIs, Apache, SaaS, Communication skills, Python, jQuery, MySQL, Time management"
Senior Software Engineer Canada Remote,Motorola Solutions,"Toronto, ON",https://www.workopolis.com/jobsearch/viewjob/RDpDgXC0EduvkVzHJDfgLDFtY6rC5pBywuP37EvagN-P9V2chXN7PJDjREXocQeR,"Azure, Node.js, Software Engineering, React, Engineering, Google Cloud Platform, AWS, Bachelor's, Machine learning, Network protocols, REST, Natural language processing, Recruiting, APIs, Vue.js, Communication skills, Analytics"
Senior Software Developer (Content Discovery),Loopio,"Toronto, ON",https://www.workopolis.com/jobsearch/viewjob/CCMKBlmK2HP6-IQjpHpte2ZJ1oIfZB1m1HRxeF7c8trzMe757HLTCGv06pnv1fVx,"Elasticsearch, React, Java, Database design, PHP, AWS, JavaScript, REST, Software development, APIs, Python, MySQL"
Senior Full Stack Developer,Blanc Labs,"Toronto, ON",https://www.workopolis.com/jobsearch/viewjob/_caSA_mcak30W-4iXj6ys6-UmabPG_m2bXIFpaVDEU1wmi7ImVXGbKCf3UJBU7H1,"Web design, Spring Boot, Authentication, Azure, Oracle, Computer Science, JUnit, Bootstrap, React, Bamboo, Relational databases, Git, Google Cloud Platform, Responsive design, Java, Application development, SQL, AWS, Analysis skills, Docker, SSL, Cloud development, JavaScript, Version control systems, REST, Angular, GitHub, APIs, Vue.js, Leadership, Jenkins, GitLab, Communication skills, Spring, MySQL, SDLC"
"Full Stack Developer (REACT, Java)",407 ETR,"Woodbridge, ON",https://www.workopolis.com/jobsearch/viewjob/HEhEs7baqiWSQ-LcHxKLOHKoGaH33SjgclpTMsCDjS0AUDWk5gCh6TheZNkTZaM3,"Spring Boot, UI development, Cloud infrastructure, Oracle, Node.js, Computer Science, CSS, React, Test-driven development, Java, Databases, Microservices, SQL, AWS, C++, Bachelor's, Continuous improvement, JavaScript, Scala, Continuous integration, REST, Redux, SEO, Scrum, GitHub, APIs, UI, Test cases, Apache, JDBC, Redshift, DynamoDB, Pair programming, Communication skills, Spring, HTML5, Information Technology, Design patterns"
Senior Full Stack Developer,Seven Hills Technology inc,"Toronto, ON",https://www.workopolis.com/jobsearch/viewjob/QnwITYKBF5Zlb5g1dGSZG9I_jF2REAjZrC7Yltl_rWKl3o1s6mER7m8oWVSNPNeV,"Jira, React, Git, AWS, Docker, PostgreSQL, Terraform, APIs, Unit testing, Python"
Senior Developer,CI Financial,"Toronto, ON",https://www.workopolis.com/jobsearch/viewjob/l3kcm0VEdJTSAWNgzAsYhP7CgSrmKoCm6dLyXC7t41wKzCq2_TYYTxyXfiuN6h4j,
Web Application Developer,TemboSocial,"Toronto, ON",https://www.workopolis.com/jobsearch/viewjob/seAKrHNECKm8npKtKMu4LX0DB1MsGzG417QVDDMdxRMlO4YZysoYuu_KwHX5qv5o,"UI development, CSS, React, Git, Test-driven development, JavaScript, REST, Scrum, Agile, Web services, UI, Unit testing, LAMP stack, Communication skills, jQuery, HTML5, MySQL"
INTERMEDIATE WEB DEVELOPER,AXIS Database Marketing,"Mississauga, ON",https://www.workopolis.com/jobsearch/viewjob/cP2xPqb-cp1hEVmwnugIwqRpwSG4WG607YhZ4n3nWt-atdaPphDhK04EzSG8en1i,"Backbone.js, AJAX, ASP.NET, Computer science, Computer Science, CSS, React, Web development, Relational databases, C#, Microsoft SQL Server, Databases, SOAP, SQL, PHP, Bachelor's, JavaScript, REST, Angular, APIs, Communications, JSON, College diploma, Adobe Acrobat, jQuery, HTML5, Design patterns"
Principal Software Developer,Intuit,"Toronto, ON",https://www.workopolis.com/jobsearch/viewjob/7rSEkx_gvmYe0eGgwh_qgsusSWwKE_hLaB16GH7JQWPFuq-z02W9p3gm4i22X0ww,"Kotlin, Node.js, Computer Science, React, Full-stack development, iOS, Google Cloud Platform, Java, Master's degree, AWS, Analysis skills, Bachelor's, Distributed systems, Angular, Cloud computing, AI, TypeScript, Communication skills, Python, Spring, High availability"
Full Stack Developer,PTS Consulting Services,"Toronto, ON",https://www.workopolis.com/jobsearch/viewjob/rhLexnK4QYeoRVBardcBCW81ddOL1eBEoL9baBjFmDIAeYw-5BlJdBVQ4iDilch2,"Azure, Node.js, Computer Science, CSS, Software Engineering, React, Web development, Full-stack development, Relational databases, Engineering, NoSQL, Git, MongoDB, AWS, Analysis skills, Express.js, Bachelor's, JavaScript, PostgreSQL, REST, Angular, Software development, APIs, Agile, Front-end development, S3, HTML5, MySQL"
Senior Full Stack Developer,Monsters Aliens Robots Zombies,"Toronto, ON",https://www.workopolis.com/jobsearch/viewjob/hGl-l7K4l2zMAFSJbtzDmWS3U8SE-canA19_VZ2RKZqDYsHp0qM4knP4WmLXsgSX,"CI/CD, Azure, Computer Science, React, Kubernetes, Web development, DevOps, Engineering, NoSQL, Git, Google Cloud Platform, Databases, SQL, AWS, Docker, Bachelor's, Machine learning, Version control systems, Terraform, REST, APIs, Web services, Integration testing, Canvas, TypeScript, Python, HTML5, Computer graphics"
Azure Developer,Tekshapers Inc,"Toronto, ON",https://www.workopolis.com/jobsearch/viewjob/01Hm6fb9q5oPlLEo8RCiUaV_FVG07Q8mJvwjpjNeXYKe9Gj4Omt2D_Aok6c76sEJ,
Senior Software Developer - Full Stack (Contract),Intelliware,"Toronto, ON",https://www.workopolis.com/jobsearch/viewjob/yc4eR5mfUYS0WzTvu6kfAj4KP2E6_lb8AbiHcQRlrAGXAC1to1PyEsMBHPA_iEbW,"Computer science, Kotlin, Azure, Node.js, CSS, React, XML, Data structures, Spark, UNIX, NoSQL, PaaS, MongoDB, Java, SQL, AWS, JavaScript, Distributed systems, Terraform, Angular, Agile, Linux, Kafka, Spring, HTML5, Hadoop, Design patterns"
Full Stack Java Developer,Eclerx,"Toronto, ON",https://www.workopolis.com/jobsearch/viewjob/Szpxkvvf12lKbo_Qwv3SF7d-jRjGHzXbUbKC9mGN05uFaaGpOh56INhD76_v5mLI,"Oracle, Computer Science, React, Full-stack development, Relational databases, Java, SQL, OOP, Bachelor's, JavaScript, REST, Angular, APIs, Ext JS, Communication skills, Spring, Information Technology"
Site Reliability Engineer,Scotiabank,"Toronto, ON",https://www.workopolis.com/jobsearch/viewjob/Z1BlJRzqBAub0hn6iJbn-eVwS6J2JsJDV5tE2kEpQraBMR-gFKITVt1B7TxfAiz8,
Software Engineer,Scotiabank,"Toronto, ON",https://www.workopolis.com/jobsearch/viewjob/QZNB_61EPmZG_nwd4TiAqCMTZ7g0YnZ69Dj0ZQFZoULaMuVcloPAx0-jBeivezpg,
"Back-end Developer, Contractor (3-month)",The Canadian Press,"Toronto, ON",https://www.workopolis.com/jobsearch/viewjob/Ep4h8Ogzo5qoiZDzA8nnHbhofQq-1CGBmeecJaLX8_a4XEcTTpV6N3zfjgRg01KM,"Node.js, Computer Science, React, Engineering, C#, System architecture, NoSQL, Git, MongoDB, Databases, Microservices, SQL, AWS, Database management, Bachelor's, JavaScript, REST, Scripting, Angular, GitHub, APIs, Web services, DynamoDB, Communication skills, Entity Framework, Python, MySQL"
Full Stack Technical Lead (Remote or Hybrid),Red Label Vacations,"Toronto, ON",https://www.workopolis.com/jobsearch/viewjob/GTRsM7a7gE2mCxrIFl28vdzf-_sXQ-YK7Up7dehtXoTz_j4RlAmn8uL0FvuWpxYd,
Software Engineer - Mobile Platform,Samsara,"Toronto, ON",https://www.workopolis.com/jobsearch/viewjob/djG8AySOnOU17EiW6CXwEP9hgnnTYm0SwSoplcE7-W6zgBMLUmeK0ZcsIX8vODKj,"Computer Science, React, Engineering, iOS, Bachelor's, Usability, Redux, Software development, GraphQL, TypeScript, React Native"
"Manager, Software Engineering - Frontend Foundations",Jobber,"Toronto, ON",https://www.workopolis.com/jobsearch/viewjob/Sb7zeBw5zOb-xslYPNuAYPAWRBb8mFDgd722OkY3ULQvfVzRX41fdY61EC4t1BNW,
"Manager, Software Engineering, Digital Banking",EQ Bank | Equitable Bank,"Toronto, ON",https://www.workopolis.com/jobsearch/viewjob/T_BJjc_DLBGkhmvioavQvgDuDHZ9k6OAa4KaxgHrKhBKsTz6CRxYGWMKPat_Ds5v,
Senior Full Stack Developer,Konrad,"Toronto, ON",https://www.workopolis.com/jobsearch/viewjob/0B7dg_wQDQ5NJ0wtHDIH_p-_EDSzt8baKXp1PChoMOMwSmt1o332WSnSN_0hhdUZ,
Senior Software Engineer (Full Stack),Venterra Realty,"Richmond Hill, ON",https://www.workopolis.com/jobsearch/viewjob/NoW2hnIm4ylGFGfO_9CJzibt852hbxO9yiV5VvF0_HxvikAG3NXtXrSlGVKm-xTX,"React, Relational databases, iOS, Microsoft SQL Server, Git, Java, SQL, AWS, Analysis skills, JavaScript, Version control systems, REST, Redux, Angular, APIs, Agile, Front-end development, TypeScript, React Native"
Senior Software Engineer,SGS,"Toronto, ON",https://www.workopolis.com/jobsearch/viewjob/k25J9emf9T6UbMU2m7CxOgw82ggaFCbrQXGW_26nnCCF07ivYZOsQL4QA_LiHM9o,"MCSD, ASP.NET, Azure, Oracle, MVC, Computer Science, CSS, React, PMP, Relational databases, DevOps, Engineering, C#, UNIX, Maintenance, Windows, .NET, Java, SQL, OOP, Project management, C, Bachelor's, JavaScript, REST, Computer Engineering, Angular, Software development, APIs, Unit testing, gRPC, Data warehouse, Entity Framework, Python, PowerShell, HTML5, TOGAF Certification, Information Technology"
"developer, software",Lane Four,"Toronto, ON",https://www.workopolis.com/jobsearch/viewjob/i0MjJtUBktLQQNhup1NzM4xQggw2ODCMLgHc15uyDRL_oh5rOdyLz4_LfwkjQSuA,"CSS, React, C#, English, Java, High school diploma or GED, JavaScript, Agile, Computer skills, Python, MySQL"
Associate Software Developer,S&P Global,"Toronto, ON",https://www.workopolis.com/jobsearch/viewjob/ETnhDxfDeHjhHymJ78DpurdmmqErIDCbl7zzdEBhwDp003JmLedSYIbplMr3yFFV,
Java Developer,Veltech Solutions Inc,"Toronto, ON",https://www.workopolis.com/jobsearch/viewjob/8TVfIBazTXMYqH-AjU_gk54WN4TCBl4lX0qH-pjS9sprkswf8fkxyCzJq68wGk9-,"Spring Boot, React, Kanban, Spark, Microsoft SQL Server, NoSQL, Java, Databases, Microservices, SQL, Scala, REST, Scrum, Software development, APIs, Agile, PL/SQL, Communication skills, Python, Hadoop"
Corporate Application Technical Leader (Senior Front-End developer),City of Toronto,"Toronto, ON",https://www.workopolis.com/jobsearch/viewjob/rBEkUqyewrkmYcE9NkQBwMlATAY2c7GhgIV8mehh14lO0pnwtfhWD88yDxOY3txR,"Microsoft Powerpoint, Microsoft Word, Web accessibility, Backbone.js, Microsoft Excel, Microsoft Access, Oracle, Computer Science, CSS, Bootstrap, React, XML, Customer service, Project planning, Mobile applications, iOS, Post-secondary education, Microsoft Office, Java, Application development, SQL, Project management, JavaScript, Content development, REST, User acceptance testing, Scrum, GitHub, APIs, Content management, JSON, Root cause analysis, Business requirements, jQuery, Debugging, HTML5"
Senior Front End Developer,Element Fleet Management,"Mississauga, ON",https://www.workopolis.com/jobsearch/viewjob/GPiNK8JiGY2gOZsHFlqM600FYSq_fxGZSChUfR2Pl6_KPfQnQjPsxqtK1ZLTAa5U,"Spring Boot, Azure, Computer Science, CSS, React, Kubernetes, Full-stack development, Relational databases, DevOps, C#, Git, MongoDB, Java, Microservices, OOP, AWS, Docker, Bachelor's, JavaScript, PostgreSQL, REST, Angular, APIs, JSON, Jenkins, Communication skills, HTML5"
Full Stack Ruby on Rails and React Software Engineer,NuBinary Inc,"Toronto, ON",https://www.workopolis.com/jobsearch/viewjob/_wz1KHNfRIxWUTEjBeiab0q1rD9G124_QwzBx1F4d_iJE9lM6lfnH6Hx0mUpp2aD,
UI Full Stack Tech SME,Virtusa,"Toronto, ON",https://www.workopolis.com/jobsearch/viewjob/xutmXhL7VmKvFo7igrV5JsTqO7qMVPfKIKCY9LE63S5GCB5DrssFVYUs1q58CYH9,"Spring Boot, UI development, Oracle, CSS, JUnit, React, Relational databases, Microservices, JavaScript, PostgreSQL, JPA, REST, Redux, GitHub, APIs, Agile, Test cases, Jenkins, TypeScript, GitLab, Spring, HTML5, Hibernate, MySQL"
"Intermediate Mobile Developer, 10 Month Contract",Live Nation,"Toronto, ON",https://www.workopolis.com/jobsearch/viewjob/u21OJ64C1C224yMqGxHQkubTu5Xg232442aaQDTS9RBgEDnJCWK_ps4dgz9pfXwF,"Kotlin, React, Kubernetes, Engineering, iOS, MongoDB, SQL, Project management, Docker, Ruby on Rails, PostgreSQL, REST, Redux, Ruby, Organizational skills, APIs, Swift, Communication skills"
Full Stack Developer (Backend Bias),Element Fleet Management,"Mississauga, ON",https://www.workopolis.com/jobsearch/viewjob/Lii9pF7oXJLBvAFjsfPdGitCRQ73nMGzzGSiK3OgkaS4hArOMXoOfXxo84MnuzRa,"Spring Boot, Azure, Node.js, Computer Science, CSS, React, Kubernetes, Full-stack development, DevOps, C#, Git, MongoDB, Java, Microservices, OOP, AWS, Docker, Bachelor's, JavaScript, PostgreSQL, REST, Angular, APIs, Maven, Jenkins, TypeScript, Communication skills, HTML5"
Web developer,Trip Support Inc,"Thornhill, ON",https://www.workopolis.com/jobsearch/viewjob/F7bwj8hToUP2AHFJ8tTKZ-Ga5DJwYm03mriXe38t8s__nGo1732uwRLdv6P4aa6L,
Senior Fullstack Developer,Scotiabank,"Toronto, ON",https://www.workopolis.com/jobsearch/viewjob/QSgqt3bPAShjqJKQMf87vLZkLn75514r6MWorSAb2X5S1QgIYAiqKgXmt9xTj6xp,
Android Developer,Konrad,"Toronto, ON",https://www.workopolis.com/jobsearch/viewjob/3yNPDEMQ05UV3tEmR7JYbony_g4sHbgpMrLDQxrWKp-1MYuq6Uw0DcOurUSTqhuT,
General Developer Posting - Future,Interaxon,"Toronto, ON",https://www.workopolis.com/jobsearch/viewjob/JJw9A7wbfBg5aX2TzU_0MLahWkqI3cakTn85vhIm_sQ_cEJUoIK7KpZdfewtejr9,"Kotlin, iOS, Google Cloud Platform, C++, Bachelor's, Ruby on Rails, Swift, Communication skills, Python, React Native"
Senior Full Stack Developer (MERN Stack – Lead),Research Pandit,"Mississauga, ON",https://www.workopolis.com/jobsearch/viewjob/DgQJ_CU81CIbzstRddQCRo98Ffdm-E5gbUq3p8kqYdKaOqH_gyAvt2BKC-3zAud2,
"Sr. Full Stack Developer (REACT, Java, Spring)",407 ETR,"Woodbridge, ON",https://www.workopolis.com/jobsearch/viewjob/PhS4nyG5NDJpd-jcDfl-z6XsmUJ2Qdudg7nAbZXLRNSjb6YG-IjBk_-PcoAg98Wb,
Senior Software Engineer (Fullstack/Frontend),CanCap Management Inc.,"Mississauga, ON",https://www.workopolis.com/jobsearch/viewjob/QKwDmLZRMgf7hL_CBndCIYsuZPCUd2qvmmo1j3-eJCnx3_LaSLmjuuETb70oJs8Q,
Senior Software Developer,Loopio,"Toronto, ON",https://www.workopolis.com/jobsearch/viewjob/1_Z4XnYJRxAXsVH3mAaUJ0C6c-hN3NQ3NhJ0MtU-PPNCvysFoL7Iw9rRCfp-BotB,"Elasticsearch, React, Java, Database design, PHP, AWS, JavaScript, REST, Software development, APIs, TypeScript, Python, MySQL"
Software Developer,IBM,"Markham, ON",https://www.workopolis.com/jobsearch/viewjob/K0mIVniDtyGgrl46YIQyslk9TcSTEUJd5USh2UrNAeASpCylKNrpTvd29MptbxVH,"Node.js, React, Kubernetes, Writing skills, UNIX, Application development, Analysis skills, Docker, Machine learning, Cloud development, JavaScript, Software development, GitHub, Agile, Design thinking, Linux, TypeScript, Communication skills"
Senior Frontend Engineer,Snowflake,"Toronto, ON",https://www.workopolis.com/jobsearch/viewjob/gtnvtS3cb3owHElTHuzmtP2uFeEKx75AhpTrAZtfST0u2PsxEBKgtfFsjrB3t6iu,"UI development, Go, Node.js, React, Kubernetes, Mobile applications, Application development, JavaScript, Angular, Software development, APIs, System development, UI, Leadership, TypeScript, GIS"
Software Developer: Web3 & Fintech,Secure Digital Markets,"Toronto, ON",https://www.workopolis.com/jobsearch/viewjob/4AG0mCGvFf9972SX3jfI2ZTm_AXCIAt47brpszL8Sx-wudun7GGeNG94tpUE9zuh,"Azure, Go, Node.js, Cassandra, React, Full-stack development, Blockchain, ERP systems, NoSQL, Git, Google Cloud Platform, SQL, AWS, Docker, JavaScript, Terraform, RabbitMQ, Angular, Software development, APIs, Puppet, Chef, TypeScript, Communication skills"
Full Stack Senior Application Developer,H.I.S Canada Travel Inc.,"Etobicoke, ON",https://www.workopolis.com/jobsearch/viewjob/N4SpcxWWxrBlhIhrS-STRfh3TlkaDmIKU9Azq0SdPustSBfwHKvwPZyTTNxX6teS,
Software Developer (Full Stack) 7644-0514,Foilcon,"Toronto, ON",https://www.workopolis.com/jobsearch/viewjob/mNN08sHK19-v2bfylEAAEj3_dcke3ROuf6G9W4r4wCaXidwZW7F-uXEqRBJzTBi0,"Web accessibility, Spring Boot, CI/CD, Oracle, CSS, PCI, React, Full-stack development, WebSphere, Load balancing, DevOps, J2EE, UI design, Java, Application development, Databases, Database design, JAWS, REST, JSP, Angular, UX, Software development, APIs, UI, Eclipse, Communication skills, Information management, Spring, Negotiation, Debugging, HTML5, Mobile devices, SDLC"
Senior Full Stack Developer,GateThree Inc,"Mississauga, ON",https://www.workopolis.com/jobsearch/viewjob/uRPwUbTRqsgsxuh1Mzv_wqq6Yyn5DjDidxm6fJlLI3_6cMBDwJ2rLa5kEA3INRPM,"Spring Boot, Elasticsearch, Azure, Go, Node.js, CSS, React, Kubernetes, Web development, Full-stack development, DevOps, NoSQL, Git, Google Cloud Platform, MongoDB, Java, Databases, Microservices, AWS, Docker, JavaScript, Redis, RabbitMQ, REST, Redux, APIs, Maven, TypeScript, HTML5, MySQL"
Front End Web Developer 7008-2212,Foilcon,"Toronto, ON",https://www.workopolis.com/jobsearch/viewjob/zYMDI8tM54kZZJ5SI9tHHx_KsPV_SF6tEtCXrPUOkehyRHCN2bOjhJ91f_YP27ua,"Web design, Node.js, CSS, React, Kubernetes, Mobile applications, .NET Core, Encryption, Responsive design, Java, Application development, Databases, SOAP, PKI, Docker, JavaScript, Continuous integration, REST, Angular, Django, UX, Software development, APIs, Agile, JSON, TypeScript, Communication skills, Information management, Python, Shell Scripting, Negotiation, Debugging, HTML5, SDLC"
Senior Digital Developer,Definity Financial Corporation,"Toronto, ON",https://www.workopolis.com/jobsearch/viewjob/dO82zgST154JTszpKHYTLvblxAC1KlIYPZLcCWLcLAuUrY-YtE9Y_UWdCPBfHfmY,
Sr. Full Stack Developer,Syntronic,"Markham, ON",https://www.workopolis.com/jobsearch/viewjob/cumtmGvGnd8pAuHrLjo2BtQMWmdp6lxdvpRTPjKKoNu88RYhJUCV6dIz0CTZVd0s,"Spring Boot, CI/CD, Computer Science, CSS, React, Kubernetes, Full-stack development, DevOps, NoSQL, Git, Java, Databases, SQL, AWS, Docker, Bachelor's, JavaScript, Version control systems, Terraform, REST, Redux, Scrum, Telecommunication, APIs, Agile, Front-end development, S3, Web services, Communication skills, HTML5, Identity & access management, Information Technology"
Microsoft .Net Developer,TV2 Consulting,"Toronto, ON",https://www.workopolis.com/jobsearch/viewjob/eDk1zFgTf1P7gw1Bn7XGb0lbTtZV6TnEnyNKHevojW8UZCL6s_FC2_qNfQbr6Sma,"AJAX, ASP.NET, CSS, React, XML, .NET Core, C#, .NET, Analysis skills, JavaScript, Agile, JSON, ASP, Leadership, Communication skills, jQuery, HTML5, XHTML, T-SQL"
Software Developer,Blue J,"Toronto, ON",https://www.workopolis.com/jobsearch/viewjob/vp8it--fJlydw4PcJ69rrFGC9b12Bz1x0jtcEmcSX6aCMYYfZgIRrSUmMgtJy4PJ,
"AI Integration, Full Stack Developer",Klick Health,"Toronto, ON",https://www.workopolis.com/jobsearch/viewjob/zaEXRsCn2HR5ee7Fr4SJQkrtfuwHb6ymegrnGMqZRS_b5ZfP8n-bw7TfTlEpRf8G,"Authentication, Elasticsearch, CSS, React, Full-stack development, DevOps, Data structures, NoSQL, Databases, Microservices, SQL, AWS, JavaScript, PostgreSQL, REST, Angular, APIs, Flask, AI, Python, Debugging, HTML5"
Full Stack Engineer,Paymentus (Canada) Corporation,"Richmond Hill, ON",https://www.workopolis.com/jobsearch/viewjob/ROsHogiiB2nNneldlxxTLVMaAXwSxRH89B57Gd_H3VhBptoeHzgAs2t6L0_jogSI,
"C++ Developer @ Toronto, ON - Canada - Long-term",Atlantis IT group,"Toronto, ON",https://www.workopolis.com/jobsearch/viewjob/saSs1mfjAxxc44A2U19AkUikkPGAz20l4BuPcjf9qsAqza2mL3PZRmZ3T04rUU34,"CI/CD, Oracle, Cassandra, React, Web development, DB2, UNIX, Git, MongoDB, Java, OOP, C++, Angular, Linux, Spring, Hibernate"
Senior Systems Developer,Healthcare of Ontario Pension Plan (HOOPP),"Toronto, ON",https://www.workopolis.com/jobsearch/viewjob/U9w4ctiuxSCtiqIrHlQDUNL2g08FpsdKNEOOp7Z-_zztrgADALKWGBUNTsmdn_8K,
Full Stack Developer (ERP),Axiom Group Inc.,"Aurora, ON",https://www.workopolis.com/jobsearch/viewjob/b1xRhPmZTQfyYqGHuRUi7nMmOcZWmUyR1TUWareqFdL1xhJgILviJtLGWwHi1mzM,
Full Stack Development Lead,DAC Canada,"Toronto, ON",https://www.workopolis.com/jobsearch/viewjob/W3g_AHAlgzVL9ijR7j9AYNU5vxrO1og8Zibi_40bIscNeSA9qlTcyNJrk9PPsOWF,
"Senior Fullstack / Web Engineer, Fintech (Remote)",Hopper,"Toronto, ON",https://www.workopolis.com/jobsearch/viewjob/f7RnWXtN9L4mYxzllzk8HYO9DGyRc5feKlCTMvSNmya-G-qtCbsqSvkMIQ_xJHKX,
Software Engineer (Full Stack),Citylitics,"Toronto, ON",https://www.workopolis.com/jobsearch/viewjob/u2xe4mSGNoAbUGy8YbcmAtK2g_5I6gDKaVUODlJntWww6ZmfMJvooyeGd-tDAK_i,"Jira, Computer Science, React, Full-stack development, Engineering, UNIX, Git, Google Cloud Platform, SQL, AWS, Bachelor's, Distributed systems, Django, GitHub, APIs, Agile, TypeScript, Communication skills, SDLC"
Sr. Software Engineer (DotNet),KALSOFT,"Mississauga, ON",https://www.workopolis.com/jobsearch/viewjob/uch8sUWp0xY99bj4oRCtUy4y975AcQUYxetqSdFR8_uj6R2A9O2KM9yCcb4aI6qK,"ArcGIS, CI/CD, ASP.NET, Azure, MVC, Computer Science, CSS, Bootstrap, React, Kanban, Engineering, .NET Core, Visual Studio, C#, .NET, Master's degree, Application development, Databases, SQL, WCF, Bachelor's, JavaScript, REST, Angular, Scrum, GitHub, APIs, Agile, Communication skills, HTML5"
.NET Developer 0091-2210,Foilcon,"Toronto, ON",https://www.workopolis.com/jobsearch/viewjob/L8quCIRv9t5aqvl_jyCuV391GMLXG02LhX39elpnd-KOlJvtCMNU7fYekmWnxXBw,"AJAX, ASP.NET, Azure, CSS, Bootstrap, React, XML, IIS, Visual Basic, Database development, DevOps, C#, Microsoft SQL Server, .NET, Application development, OOP, JavaScript, REST, Angular, Agile, JSON, SSIS, TypeScript, jQuery, HTML5"
Web developer,Scriptbox,"Mississauga, ON",https://www.workopolis.com/jobsearch/viewjob/Fd4Muuv7GT-ci_zIi6vUEZJyaoxkEQJoqDGmhLe1OLlg6YxWR25zbIqXeoDOISCC,"React, XML, English, SQL, JavaScript, JSP, Computer skills, College diploma, Communication skills, HTML5"
