job_title,company,location,link,skills
Full Stack Developer,Evenica Corp,"Burlington, ON",https://www.workopolis.com/jobsearch/viewjob/9CGVLPhqXeTl8Vddl1nI1330MBG_4B3h1TjrNwY0WbEFpmkHXA_YF9nm4cYf8ZDi,
"UX/UI Designer (remote, open roster contract opportunity)",Crowdlinker,"Toronto, ON",https://www.workopolis.com/jobsearch/viewjob/U_J3sCl4tpQ62zuzpuuFBO54ccXcZvmBajNbmdjdXtoX8ypgRn5wXDFsZFF-cG3j,"Typography, CSS, React, WordPress, Mobile applications, iOS, Android, UX, Agile, Design thinking, Budgeting, Interaction design, Figma, Communication skills, HTML5, Digital design"
WordPress Developer (Full Stack),Uncanny Owl,"Toronto, ON",https://www.workopolis.com/jobsearch/viewjob/FtjypGxNRYRnfH_oeIS2Dn9FzXGCIgjGihtWHIo37dkaLXj718cmAD2CEQRR-xQs,"UI development, CSS, React, WordPress, DevOps, Git, Test-driven development, English, UI design, PHP, OOP, JavaScript, SCSS, REST, UX, MailChimp, GitHub, APIs, HTML5, MySQL"
Senior Full Stack Software Developer,TouchBistro,"Toronto, ON",https://www.workopolis.com/jobsearch/viewjob/rDG3fHYJYsQJYFWTsETK6twhTHhwSL4EgfdIMGDNMYcIiEknJkphZyPDU_AwGNcY,
Senior Mobile Developer (React Native),Lightspeed,"Toronto, ON",https://www.workopolis.com/jobsearch/viewjob/5uZysG_M7QZqlhC0k00uQsSHLb-cAFOuBSFl8fIBZp4MGVZEVsou1gC3ur52A7Wy,
Mobile App Developer,Shift Technologies Canada Inc.,"Scarborough, ON",https://www.workopolis.com/jobsearch/viewjob/ZnL82CbzKHuu2K5dviMfwX0UAzQC27Mf2SMv8ABjQoctqDvaVIVbXPcbDtLmuHqg,"iOS development, Mobile applications, Git, English, Application development, Flutter, Bachelor's, Version control systems, REST, APIs, JSON, Android development, React Native, Debugging"
