job_title,company,location,link,skills
Sr React JS Developer,ydc pro Inc,"Toronto, ON",https://www.workopolis.com/jobsearch/viewjob/mf-qzPUjTvnaOatORrWeTlb2gsnkvWcMEVoSR6BFxeoPfOhnSSOu_chDTOhxm1fg,"React, SQL, JavaScript"
Full Stack Developer,WeVend,"North York, ON",https://www.workopolis.com/jobsearch/viewjob/53s-v_whtKuoRDXBRyUJp1hCCeE8TNpoXUrzD56eZoJEdjAO82Deho40VLikmZTI,
Frontend Developer (React and Next.js),Stellar Elements,"Toronto, ON",https://www.workopolis.com/jobsearch/viewjob/YXMlMxij9CAyLuQY3uSDHv67FEmY6NIo1hJrvtKrtatcIQSmuiCUa__D21I_8vDv,"React, Git, JavaScript, Redis, ECMAScript, REST, GitHub, APIs, Agile, Front-end development"
Senior Full Stack Developer,Touchless Inc,"Toronto, ON",https://www.workopolis.com/jobsearch/viewjob/JxyEcf6E1wyKQaLvXGtGSUgx3X-h8frGmdRZ_Q0my5ElYOIQVHNrW9uJGwghgeOd,
React Front End Developer (PL570),Paralucent,"Toronto, ON",https://www.workopolis.com/jobsearch/viewjob/tJQBOUQBK3zSRqhYRhMebazZZ6hyUQCuPkUJHt8SVvoIvCcqOucC_AHmb1oMBuvq,"Computer Science, React, Engineering, Presentation skills, Bachelor's, Linux, Apache, Kafka, Data visualization"
Java Developer,HANKER SYSTEMS PRIVATE LIMITE,"Toronto, ON",https://www.workopolis.com/jobsearch/viewjob/HNCo1dMo0ERdbQsnpmakoDXK7fQFjlvblCVEsK7tCqBnz2ZqSmK7UKUnZu8G-myg,"CI/CD, Oracle, Cassandra, React, Web development, DB2, UNIX, Git, MongoDB, Java, OOP, Bachelor's, Angular, Linux, Spring, Hibernate"
Frontend Javascript Developer,Arternal,"Toronto, ON",https://www.workopolis.com/jobsearch/viewjob/O312l0z_k5i_56TfMiOOqDm68HGKebr4aKFHCQkoq79Ons1YkTq9jBpImTsXkGOD,"React, JavaScript, Angular, GraphQL, Vue.js"
InDesign JavaScript Developer,St. Joseph Communications,"Toronto, ON",https://www.workopolis.com/jobsearch/viewjob/h-X1ZMrYU0hcaKkm3zBSiA5JlswjtLQ7CHFA3KoD2vG3Et-6sjRb8cHfbyjFkbNl,
Front-End Developer,CanCap Management Inc.,"Toronto, ON",https://www.workopolis.com/jobsearch/viewjob/ktKo6YpmX-O6PCao3MJ98AAWHU-fa-GmRZcPabcTTfc058ycFWU2POzkHCbrcJU8,"CSS, React, Kanban, Google Cloud Platform, Bachelor's, JavaScript, Angular, UX, Software development, GitHub, APIs, Agile, Vue.js, HTML5"
Mobile Application Developer,WeVend,"North York, ON",https://www.workopolis.com/jobsearch/viewjob/DD9GkxoE70pLaFIdmjGu77mUuQsDQ4eSIdYea5zpKxF-S1QkFD5VaMLUVKuO69Fj,
Front End Developer - React,Dawn InfoTek Inc.,"Toronto, ON",https://www.workopolis.com/jobsearch/viewjob/L6mLhD-crWjNniTkoDmRZSQrxHoHLygp-0SBgpIjCEScufhUoQ9Yj4Gu53Y3P2EY,"Authentication, UI development, Azure, Computer Science, React, Google Cloud Platform, Master's degree, SQL, Database management, Bachelor's, Angular, Agile, Cloud computing, UI, Communication skills, Spring"
Node js developer,Zenith System Solutions Inc.,"Toronto, ON",https://www.workopolis.com/jobsearch/viewjob/uuFA0q4iNiUl3Uu7i6DgwLN4allCCbamZBc35vEj357z_Y8M2d7cFnF2eY8xt5Rh,"Node.js, CSS, React, Web development, JavaScript, Angular, JSON, HTML5"
Front End Developer,Shift Technologies Canada Inc.,"Scarborough, ON",https://www.workopolis.com/jobsearch/viewjob/aEIfIDG3QYElEqTL7m-AGH_1vtKaZIf2a8ownuCI_HyMdbMuUUKcKbz6byyWORXR,
"Front-End Engineer II, CreativeX (Amazon Ads)",Amazon Development Centre Canada ULC,"Toronto, ON",https://www.workopolis.com/jobsearch/viewjob/kuKJCn8QYAvrJE5Uo2pWTmS_eOI21FD-cLxeDyK_bGw4z38XqjbCcXOTnojS_JE3,"Computer Science, React, Bachelor's, Angular, UX, Software development, SDLC"
Software Developer - .NET/C#/React,Moneris Solutions,"Toronto, ON",https://www.workopolis.com/jobsearch/viewjob/c2mcnINjZ29q-hHWqgBb1CtxjO_8wHpVqk7Tuy9y1wRVKSKGUr09SSQp6E4_XU-k,
Full Stack Developer,Accenture,"Toronto, ON",https://www.workopolis.com/jobsearch/viewjob/s_brO30Npk-i5Dz42nBRlyL8jbTFEKypB4yMkujdzGeGtMYwwImcfrcym22VNUFY,"Jira, Spring Boot, Node.js, React, Full-stack development, DevOps, Git, Java, REST, Angular, APIs, Kafka, Jenkins, Spring"
Mobile Application Developer,System Dynamics Corporation,"Markham, ON",https://www.workopolis.com/jobsearch/viewjob/9sHCZtJIWp6vvAGM3aq3ljfBNGcGXOetwxb-dmk5Bp4uLAFtoCyv32-euEh7jqTG,
Front End Developer,ApplyToEducation,"Toronto, ON",https://www.workopolis.com/jobsearch/viewjob/GYb7qQZHpDrEBxczDREpBCmmDkl9t8mMGaFL2iF4hPGnZcHlPpcXof7zhIzpzjvV,"Computer Science, CSS, Bootstrap, React, Engineering, Git, Responsive design, Bachelor's, JavaScript, Version control systems, REST, APIs, UI, jQuery, HTML5"
"Front End and Full Stack Developer (Remote - Ontario, Canada ONLY)",Ample Insight Inc.,"Toronto, ON",https://www.workopolis.com/jobsearch/viewjob/TKq5Pn5QNGhonY7bJCyN9tvQOAR8E-g3-xheGicO-AXLqS5tFcIXq54nLa7tMH4m,"Node.js, Doctoral degree, Computer Science, React, Engineering, Master's degree, Bachelor's, Software development, TypeScript"
Typescript / React Backstage.io Developer,Atlantis IT group,"Toronto, ON",https://www.workopolis.com/jobsearch/viewjob/SGlJvT6Cpuq12hTJbX3zMEtXkdah_Tkf3rdb_TroeibgzeHZVLG28wiDwJv1hN0d,"Node.js, React, Web development, JavaScript, APIs, GraphQL, TypeScript"
Java Developer (Node JS),Zenith Algorithms,"Toronto, ON",https://www.workopolis.com/jobsearch/viewjob/UJVJ_NHGdMCZj_uFBJ_B0dAK1XFmaVYy-vPadUEMMdlO1egoM1LVrps1jrgPrb5V,"Node.js, CSS, React, Java, Bachelor's, JavaScript, PostgreSQL, HP Performance Center, REST, APIs, Integration testing, HTML5"
Full Stack Web Developer,Boffin Language Group Inc.,"North York, ON",https://www.workopolis.com/jobsearch/viewjob/dFm9TC2SHmApO6ORMlXPa4MQpsvHQgFnNJR3dhoOoC8U75jI2BX_D6uCivljVDmE,
Senior Software Developer - React and .Net,AirGate Technologies Inc.,"Vaughan, ON",https://www.workopolis.com/jobsearch/viewjob/_pPRGJEXyDZz4MJgcFd3R6g-r3tj7pJ3Gl2hvl7RZDKveG1C5Yif1yVeIog9BWX4,
Software Developer,William Thomas Digital,"Toronto, ON",https://www.workopolis.com/jobsearch/viewjob/1zlBrNRl2dhsN_4lpbfHC9aUrBSWlsfizSedxFqO5okyD_byOSjSptrJNbNXZLV-,"Node.js, CSS, React, Writing skills, Content management systems, PaaS, Git, SOAP, SQL, AWS, Project management, JavaScript, PostgreSQL, REST, APIs, GraphQL, Heroku, Communication skills, HTML5"
Junior Software Developer,Idea Notion Development Inc.,"Markham, ON",https://www.workopolis.com/jobsearch/viewjob/Cty3CLhyPbibKTucgExHCQzRNuJ3fYT2zlS7GOkWkgsYJFIx3JDq8e1lBmKDCWcd,
Senior Mobile Developer (Java/React Native) on Android,Moneris Solutions,"Toronto, ON",https://www.workopolis.com/jobsearch/viewjob/2vocBKfgKQp8y2ih7ogyHgmsto2airUuoqX0hkcArbhkNZAEcEF_C7IRjyI9OZFl,
Senior Frontend Developer,CSC Generation,"Toronto, ON",https://www.workopolis.com/jobsearch/viewjob/UPK5asObwecpWpebzjmFirXgIyrHyiCVdTmo3g3Xs18Tf0IsPsL8eWyefbaMR5ep,
"Software Developer, New Grad",IXL Learning,"Toronto, ON",https://www.workopolis.com/jobsearch/viewjob/EVlGGIyVe9bkuIHbIfy2jMAb3qRw-0wWWxyJDXzOtOwywhCQxnGoHb9KDipFCDX-,"Computer Science, CSS, React, Git, Java, SQL, Bachelor's, JavaScript, Linux"
Web Developer,KALSOFT,"Mississauga, ON",https://www.workopolis.com/jobsearch/viewjob/iRrZTlTKXhM13KeIXLF8iIn1tzqPQqXlpUxz0aze4Ze1ki4o1SO2nGvjoyStsep9,"Website maintenance, Adobe Photoshop, Node.js, CSS, React, WordPress, Web development, Content management systems, iOS, Laravel, Adobe Illustrator, Magento, Visio, Git, Adobe Creative Suite, Application development, PHP, JavaScript, SCSS, Adobe XD, REST, SEO, Angular, Symfony, APIs, Sketch, Figma, TypeScript, Joomla, jQuery, Debugging, HTML5, MySQL"
E-business Web site developer,Monet Marketing,"Richmond Hill, ON",https://www.workopolis.com/jobsearch/viewjob/oOieFaK2TD0HO9uPbbfkIk5GvGP8IDWfNCMGO-5u4HvMjdlS4fx-i7oGJ8IYJGOj,"Node.js, React, WordPress, Sales, Microsoft SQL Server, Git, English, Java, Ruby on Rails, JavaScript, JSP, Computer skills, JSON, Chinese, College diploma, TypeScript, Python, jQuery, HTML5"
Full Stack Developer,Staples,"Richmond Hill, ON",https://www.workopolis.com/jobsearch/viewjob/xO71XGfMMo66qH4ZJJzFzNZ74Fq-h2o9drrEaxPA9kv4v3oESWyPAH9axtmOk1_i,
Hiring for Full Time React JS with Kumaran Systems - Toronto!!,Kumaran Systems Pvt Ltd,"Toronto, ON",https://www.workopolis.com/jobsearch/viewjob/S8J4rkDr-wHpnDdSezaoZe3xv2eUIyFmA36qJkEN3o-nbeVFqRucfXaZhBaQ_JYL,"Spring Boot, Oracle, React, Enterprise software, Microservices, REST, APIs, TypeScript"
SCALA / JAVA / PYTHON Developer,Veltech Solutions Inc,"Toronto, ON",https://www.workopolis.com/jobsearch/viewjob/-zXgWH16yTfmxdBvjqyODC07YB8EUjV5xvcDXLn9_80Y-9Z5-jl0yEsbnaxe1xlS,"Spring Boot, React, Kanban, Spark, Microsoft SQL Server, NoSQL, Java, Databases, Microservices, SQL, Scala, REST, Scrum, Software development, APIs, Agile, PL/SQL, Communication skills, Python, Hadoop"
Full Stack Developer - FULL TIME (preferred) or PART-TIME,Doc Clik,"Toronto, ON",https://www.workopolis.com/jobsearch/viewjob/WFBPvrRAvnfBWDsSiOFyRbnJMpWBcwI4GGsIER_stW4w0ZGz4NEXoBsmrBnDdBNt,"Node.js, Computer Science, CSS, React, Full-stack development, Mobile applications, Content management systems, iOS, Post-secondary education, Android, Databases, SQL, Ruby on Rails, JavaScript, APIs, Agile, Communication skills, React Native, HTML5, MySQL"
Web Development Intern,CEM Resorts,"Toronto, ON",https://www.workopolis.com/jobsearch/viewjob/YP_YhaQiwKEI5OVkk7DBghgXXM-vmJEJ4khtLveu6jJf-Q-J-kswGzv_7rQC9MoB,"Computer Science, CSS, React, Web development, Responsive design, Bachelor's, JavaScript, SEO, Angular, Communication skills, HTML5"
Front-End Developer AND WORDPRESS,CEM Resorts,"Toronto, ON",https://www.workopolis.com/jobsearch/viewjob/q3fustZVA0v1lXRkt-CXU19ZU1cPXWaiFcp3ZaxUeYDsDyE7L9XDmGX9Lm4UD7w_,"Web design, Website maintenance, Computer Science, CSS, Bootstrap, React, WordPress, Web development, Responsive design, PHP, Bachelor's, JavaScript, SEO, Communication skills, jQuery, HTML5, MySQL"
Senior Full Stack Engineer - React,NielsenIQ,"Toronto, ON",https://www.workopolis.com/jobsearch/viewjob/-7SqMaFHoS17k8mpXryY__9I3pQdcMn0w9lzkcSNKJlzfZIA1qHMZvpEwte3fvua,
Software Developer - Front End,Embross,"Richmond Hill, ON",https://www.workopolis.com/jobsearch/viewjob/BA2VdS-NPF4enWdUHOD7sIrsKt2TbLpMlTX7cCUZ8FpBF5lGslpcXTjh0P0i-Vah,
"Associate Educator, Web Developer",BrainStation,"Toronto, ON",https://www.workopolis.com/jobsearch/viewjob/6M1awSN4WA2jcTpzoFMHed8oFY-ps64-phSP8tKL2ZQSCG7M7f857SML6Jycg52Q,
"Educator, Web Developer",BrainStation,"Toronto, ON",https://www.workopolis.com/jobsearch/viewjob/oBV6VfdJT-OcFEFfR38v37ezJgJOA6OlHe8eA116VfzCEHvtxiZYLwfPWKzp-7UZ,
Front-End Developer,Independence Pet Group,"Oakville, ON",https://www.workopolis.com/jobsearch/viewjob/658VIuH6xz-iKi7SGdDDzF9SRCKG5RXoRRh_67pOWgPHD8C2XKNCAtsfEgYL2ZJl,
Software Developer,Scotiabank,"Toronto, ON",https://www.workopolis.com/jobsearch/viewjob/P6e4oze0zQQrEMqT6y28MsXz669pRio2CeLUis4m9JZbhSMsJ69vlCG6KLUdOk2d,
Web Developer,TV2 Consulting,"Toronto, ON",https://www.workopolis.com/jobsearch/viewjob/kBeSwIAYcw5LgGD11gCmPbad8ByIxpTvNV_ZdPWcovKQitty0E7svy2FpGiFHbkV,"Web accessibility, Node.js, CSS, React, Web development, NoSQL, Java, SQL, JavaScript, Angular, APIs, Vue.js, Python, HTML5"
Full Stack Developer (Nodejs),Remitbee Inc,"Mississauga, ON",https://www.workopolis.com/jobsearch/viewjob/Tfj98SCsayJ8QCJrUDtjk4ycKXCCPL4I2yCaswmB0e6eQsPM-u5cq-bE2lMJCR-E,
"Front-end Developer, Contractor (3-month)",The Canadian Press,"Toronto, ON",https://www.workopolis.com/jobsearch/viewjob/857inZDS0jjS8_jL9omEtcHyBUu0KJsOWJ2wQrEa1WFyz20a_D_UWzSoULQP06i1,"Web design, Computer Science, CSS, React, Databases, Bachelor's, JavaScript, Redis, Angular, Django, UX, APIs, Flask, Communication skills, Python, HTML5"
Backend Developer (Node and Java),Stellar Elements,"Toronto, ON",https://www.workopolis.com/jobsearch/viewjob/bcEVBRGmmqgaxk6-2S6IPdPulBCci2GUgZf63DwZ08wDhtOqLq87yhh8bSxI-4Xg,"Node.js, CSS, React, Java, JavaScript, PostgreSQL, REST, APIs, Integration testing, HTML5"
Senior Front End Developer,Monzek Consulting,"Toronto, ON",https://www.workopolis.com/jobsearch/viewjob/WcpXINVgpDn_GQ7pgqM-ZopcXyUchR7Pzbyz_6UHTLFvOUtoTBvhFnjlFkjbRj7r,"Web accessibility, AJAX, ASP.NET, Azure, CSS, React, Web development, Relational databases, DevOps, .NET Core, C#, Git, DEC, Application development, SQL, JavaScript, SCSS, SASS, REST, Scripting, Angular, SharePoint, APIs, Associate's degree, TypeScript, Communication skills, Python, jQuery, HTML5"
Software Developer Co-op (Fall 2024 - 8 months),Intuit,"Toronto, ON",https://www.workopolis.com/jobsearch/viewjob/I-il6M3a3uRmA8UwRlXM6mrGntqt_tHJKJJaxpiS_YGJNbb6Tw3IehCsMf1tJiQG,"Computer science, Computer Science, React, Engineering, Post-secondary education, Java, Machine learning, JavaScript, Product management, Agile, AI, Python"
Junior Software Developer - Full Stack,Intelliware,"Toronto, ON",https://www.workopolis.com/jobsearch/viewjob/Skv14Sy6rbJdyR43bJu8YKlFiO3oCBF1ZHSxV-1VklxDDCXVlN7UAaFhAE-swGk_,"Computer science, Kotlin, Azure, Node.js, CSS, React, XML, Data structures, Spark, UNIX, NoSQL, PaaS, MongoDB, Java, SQL, AWS, JavaScript, Distributed systems, Angular, Agile, Linux, Kafka, Spring, HTML5, Hadoop, Design patterns"
Full Stack Developer,Annex IT solutions,"Toronto, ON",https://www.workopolis.com/jobsearch/viewjob/zUXe6dSKb1lmlYcxu9flDrkOWQic1vKpXq8Yk2fsq5Ghn1nbL8H-x-sHEHL4x0pD,
Software Developer Co-op (Fall 2024 - 4 month),Intuit,"Toronto, ON",https://www.workopolis.com/jobsearch/viewjob/qi4Dfs7QGcb4t2VDRakh5NPyIyS75W1F2XnR80ahkmt7g_2Tv5D5Gw4PUQz5axio,"Computer Science, React, Engineering, Post-secondary education, Java, JavaScript, QuickBooks, Python, HTML5"
Senior React Full-Stack Developer,Method:CRM,"Toronto, ON",https://www.workopolis.com/jobsearch/viewjob/flhwTtLQWzKX19Q1tXGh4ioXjmPmZAJbwIQ6x2jk9FwITSprkfjvFhzXpVd-tKPr,
Senior Full Stack Developer,Fastr,"North York, ON",https://www.workopolis.com/jobsearch/viewjob/zPNAFdlySrM2c63cxkydWEcaN98fo9sJ_HnIScdPZFbJ4rIV7N1B4PPrViRvvUbZ,"Node.js, Computer Science, CSS, React, Web development, XML, English, E-commerce, Performance testing, Master's degree, PHP, AWS, Bachelor's, JavaScript, Angular, APIs, Integration testing, Communication skills, jQuery"
Full-Stack PHP Developer,Newcom Media Inc.,"Etobicoke, ON",https://www.workopolis.com/jobsearch/viewjob/gkG0AA-l9p40h8pWFXdTIU--GtcSiKP2sSazAqb1MFW_aTaZbHutDQTSc2CaSJKR,
Front-end Developer,Wisedocs AI,"Toronto, ON",https://www.workopolis.com/jobsearch/viewjob/QnfRtxNEnV5HwUjXGP5WYnM0a8xHw6CaWMCpDxsOP21Qr-bGgbtuqJwyWbBtcsAD,
React Native Developer,Smart-One Solutions,"Richmond Hill, ON",https://www.workopolis.com/jobsearch/viewjob/N3UEJPmeilICHp7Tp02_I6c_OUzE93HFfsgJUxrXc45IrRCnmJdA-c05qkI8gw1f,
Lead Java Developer,Triveni IT,"Toronto, ON",https://www.workopolis.com/jobsearch/viewjob/DPdnam625VErMdQ-OB5O2yaamgXW3ziObsFSGh7-o98F8lYjnPVZQZdXhAQnb_PT,
Senior React Developer,S&P Global,"Toronto, ON",https://www.workopolis.com/jobsearch/viewjob/U-j6je-9u_IMhiTYXTVa0lbf0nh8cSEMCjpvXgktJWhGyqCrMxluTX0kHlO3oVS8,
Senior Mobile Developer (React Native),Lightspeed Commerce,"Toronto, ON",https://www.workopolis.com/jobsearch/viewjob/5wpMD40dKEpPCjCXYOW01Ct35Ko6KYrKM_hkEfaxK2VWvtG6mi8u2EAI09LXfZnK,
Intermediate Software Developer (Remote First),Zensurance,"Toronto, ON",https://www.workopolis.com/jobsearch/viewjob/GINeYVDK2-OkoAw0Mt4WIVZkNPCy9eeXt2MMiHaBzGY6caMqWiLuCXgfprOZ1Y1U,
Senior Full Stack Developer- Python and Vue.js (GCS),Royal Bank of Canada,"Toronto, ON",https://www.workopolis.com/jobsearch/viewjob/tsecKJgDtw-_2OIeDKR9HmCjQaxLiDgmwPbfCeGwhel34Ce4GIit1Cr2YCTUD5ED,"CSS, Bootstrap, React, Web development, NoSQL, Databases, SQL, Docker, JavaScript, Angular, Django, Agile, Vue.js, Python, jQuery, HTML5"
java full stack developer with angular,Tekshapers Software Solutions Pvt Ltd,"Toronto, ON",https://www.workopolis.com/jobsearch/viewjob/-wyomPZSdaock7DmgVp9w9xQ55UOW0mkz1s56k5o3HUtjUiJbGnemv-NFSh89lJl,
"React Native Developer (remote, open roster contract opportunity)",Crowdlinker,"Toronto, ON",https://www.workopolis.com/jobsearch/viewjob/0tTGCTcNjZ2QsOwK9nKx07yd3NBNCgAfVCWXHEX2-8sWamSZrxAn67QvDlrD0N9m,"Jira, Kotlin, Node.js, React, iOS, Laravel, NoSQL, Git, Test-driven development, MongoDB, Android, Databases, SQL, Analysis skills, PostgreSQL, Version control systems, Continuous integration, Redis, SDKs, Usability, REST, GitHub, APIs, Project management software, Agile, Unit testing, DynamoDB, Vue.js, Swift, Android development, Communication skills, React Native, MySQL"
Sr. Full Stack Developer,ConnectED Labs,"Toronto, ON",https://www.workopolis.com/jobsearch/viewjob/Y_ZYtqW5SJC7lxg6Xv_SdtmsCkXekKyudUEIA6LLoaS587o_VpDExIPN3Zg-lCca,
front-end developer,PowerHub Inc.,"Toronto, ON",https://www.workopolis.com/jobsearch/viewjob/D1_Hm5C1PWRXEZgUbkVVKTTEoCGyh8l5i6WZkVtmosnhiF-JB9yzpRQmfy17J6UB,"React, English, Computer skills, Vue.js, College diploma"
Junior Full Stack Developer,Markdale Financial Management,"Toronto, ON",https://www.workopolis.com/jobsearch/viewjob/CqtaV1WFbWivJ3TgdE6pL1rQdCGleK-0rS04KemuhmFwpk06a7qNqyHi-LaS2wad,"Node.js, Computer Science, CSS, Bootstrap, React, Web development, JavaScript, REST, GitHub, APIs, Linux, JSON, HTML5, MySQL"
Software Developer - Full Stack,Intelliware,"Toronto, ON",https://www.workopolis.com/jobsearch/viewjob/qDC3iDyoTtrnKjit2cEQpqlRIZQguHfJuz0yOz02Om7jfGcKKln6pmTQO_WJp3It,"Computer science, Kotlin, Azure, Node.js, CSS, React, XML, Data structures, Spark, UNIX, NoSQL, PaaS, MongoDB, Java, SQL, AWS, JavaScript, Distributed systems, Angular, Agile, Linux, Kafka, Spring, HTML5, Hadoop, Design patterns"
Full Stack Developer,Konrad,"Toronto, ON",https://www.workopolis.com/jobsearch/viewjob/1XgFQfGrCGFcxkaHbFzyBRpbu7SWGlLxRrOQrFm4CqqbwMOfVrmCDdz5-H8W4J2y,
Full Stack Developer,Evenica Corp,"Burlington, ON",https://www.workopolis.com/jobsearch/viewjob/9CGVLPhqXeTl8Vddl1nI1330MBG_4B3h1TjrNwY0WbEFpmkHXA_YF9nm4cYf8ZDi,
"UX/UI Designer (remote, open roster contract opportunity)",Crowdlinker,"Toronto, ON",https://www.workopolis.com/jobsearch/viewjob/U_J3sCl4tpQ62zuzpuuFBO54ccXcZvmBajNbmdjdXtoX8ypgRn5wXDFsZFF-cG3j,"Typography, CSS, React, WordPress, Mobile applications, iOS, Android, UX, Agile, Design thinking, Budgeting, Interaction design, Figma, Communication skills, HTML5, Digital design"
WordPress Developer (Full Stack),Uncanny Owl,"Toronto, ON",https://www.workopolis.com/jobsearch/viewjob/FtjypGxNRYRnfH_oeIS2Dn9FzXGCIgjGihtWHIo37dkaLXj718cmAD2CEQRR-xQs,"UI development, CSS, React, WordPress, DevOps, Git, Test-driven development, English, UI design, PHP, OOP, JavaScript, SCSS, REST, UX, MailChimp, GitHub, APIs, HTML5, MySQL"
Senior Full Stack Software Developer,TouchBistro,"Toronto, ON",https://www.workopolis.com/jobsearch/viewjob/rDG3fHYJYsQJYFWTsETK6twhTHhwSL4EgfdIMGDNMYcIiEknJkphZyPDU_AwGNcY,
Senior Mobile Developer (React Native),Lightspeed,"Toronto, ON",https://www.workopolis.com/jobsearch/viewjob/5uZysG_M7QZqlhC0k00uQsSHLb-cAFOuBSFl8fIBZp4MGVZEVsou1gC3ur52A7Wy,
Mobile App Developer,Shift Technologies Canada Inc.,"Scarborough, ON",https://www.workopolis.com/jobsearch/viewjob/ZnL82CbzKHuu2K5dviMfwX0UAzQC27Mf2SMv8ABjQoctqDvaVIVbXPcbDtLmuHqg,"iOS development, Mobile applications, Git, English, Application development, Flutter, Bachelor's, Version control systems, REST, APIs, JSON, Android development, React Native, Debugging"
Web Applications Developer,TV2 Consulting,"Toronto, ON",https://www.workopolis.com/jobsearch/viewjob/VcmDekha-DLR7TmZzS4PNbDYcklYWqQwcnTBpzQf-zfyd7SCkQfQ4VsHae40G1DH,"Node.js, Computer Science, CSS, React, Web development, Laravel, Databases, SQL, PHP, Bachelor's, JavaScript, Angular, Vue.js, Communication skills, HTML5"
Senior Java Developer,Denken Solutions,"Toronto, ON",https://www.workopolis.com/jobsearch/viewjob/MHPFBGOlBLon0iPG-8pitURPQfF8Buow2bqj9x8OsHTZBPvZXzHhXq_QfS7a15n-,"Azure, Node.js, Computer Science, React, Git, Google Cloud Platform, Java, Databases, Microservices, AWS, Bachelor's, JavaScript, Angular, Project management software, Agile, Kafka, Python, Information Technology"
"Full Stack Developer (remote, open roster contract opportunity)",Crowdlinker,"Toronto, ON",https://www.workopolis.com/jobsearch/viewjob/xZRc4NxhnjtGGBThmC65HX8GVh4ZbNzIfTSM-91EBNgwaU0jWQuzQrMXOLlJJzrg,"Jira, Web design, Kotlin, Azure, Cloud architecture, Node.js, CSS, Bootstrap, React, Mobile applications, iOS, Laravel, NoSQL, Git, Test-driven development, MongoDB, Responsive design, Android, Application development, Databases, SQL, Analysis skills, JavaScript, PostgreSQL, SCSS, Version control systems, Continuous integration, Redis, SDKs, REST, Redux, GitHub, APIs, Project management software, Agile, Unit testing, DynamoDB, Vue.js, Swift, TypeScript, Communication skills, React Native, MySQL"
Lead Java Developer,GalaxE.Solutions,"Toronto, ON",https://www.workopolis.com/jobsearch/viewjob/AB0ALv93qFArEAROsHwmh-3roVhdfO7ylnEUQOwpX5Vs6i6vvYcjowm-JWm_ZLwn,"Jira, React, DevOps, R, Java, Microservices, SQL, OOP, Machine learning, REST, Angular, Vue.js, Business requirements, PL/SQL, Python"
Senior Software Developer,Blue J,"Toronto, ON",https://www.workopolis.com/jobsearch/viewjob/Tv8U3_NmnQTPhn833sKHK0Kl-GXHwwcLw1gnk5MgIGBD1DI4UoDtsguMF8O8-mo7,
Full Stack Engineer,Rush Street Interactive,"Toronto, ON",https://www.workopolis.com/jobsearch/viewjob/X8a-JH5VdenXvA0EtULwLZWqoPN9jUlr5p5zQcPExSz9OdVwKzfLlTwwhRiVUqIJ,"Gradle, React, Kanban, iOS, System design, Test-driven development, Android, Java, SQL, Docker, Product development, JavaScript, Distributed systems, REST, Angular, APIs, Agile, Web services, Kafka, Service-oriented architecture, Android development, Leadership, TypeScript, Communication skills, Spring, Hibernate, Design patterns"
Full Stack Sr Application Developer (Remote within Canada),Red Label Vacations,"Toronto, ON",https://www.workopolis.com/jobsearch/viewjob/4HckYKjmrjTWnsvP0WTf-O4NDFOFbWc__OrBsGqpk6DHC8HWZbVGmWZxn8IPAoyZ,
"Web Developer, Full Stack",Survalent,"Brampton, ON",https://www.workopolis.com/jobsearch/viewjob/NjxYyZ0mMMl7IRjGabrcvfHoj0UfHjjA6i07PcuCsmJIv_qS-GSKZnSR3yrseKSQ,
software developer,Cloud Way Solutions Inc,"North York, ON",https://www.workopolis.com/jobsearch/viewjob/8nWbFsJAVviYUQv9_2g8whLt0XtLuzkL5U-S2u4kucBECY9LLU9BZPBYU155sdV0,"Oracle, CSS, React, XML, Microsoft SQL Server, English, Java, OOP, Bachelor's, JavaScript, APIs, Computer skills"
Front End Developer,AI Financial Power Group,"Richmond Hill, ON",https://www.workopolis.com/jobsearch/viewjob/0_W277SlLsw2rsIG_j1AthNps6D5URCNNPDEBHQF2Zr5pArQbR7RmtYW9megt48V,
Senior Full Stack Developer (6-Month Contract),Jeevan Technologies,"Toronto, ON",https://www.workopolis.com/jobsearch/viewjob/CBfsFraM9VrkGQnF5InZTVJ5atyToEsw1PsrYUmXVnymqRQEvfAehYDrvOZcY6gX,"Jira, React, Git, English, AWS, Docker, Bachelor's, PostgreSQL, Terraform, APIs, Unit testing, Python"
Senior Web Developer,Knix,"Toronto, ON",https://www.workopolis.com/jobsearch/viewjob/eJ5drjJx2PQPTPFwnpGO98eHkHzcpjkcVet1J_b-89qwxKh3IKRruQq3woAWGo0e,"React, Web development, APIs, Unit testing, Business requirements, Spring"
Full Stack Web Developer,Coca-Cola Canada Bottling Limited,"Toronto, ON",https://www.workopolis.com/jobsearch/viewjob/wjxJrohcbc5fUZl2sewhj_8fuLPYAO9uNwE9R-dI2uuC6-gcZencTnFpvgTZood1,"Azure, Cloud architecture, Node.js, Computer Science, CSS, React, D3.js, NoSQL, Git, MongoDB, Responsive design, UI design, Tableau, Databases, SQL, PHP, Analysis skills, Bachelor's, JavaScript, PostgreSQL, Redis, Usability, REST, Angular, UX, GitHub, APIs, UI, User research, Data visualization, DynamoDB, Vue.js, Communication skills, Python, Information architecture, HTML5, MySQL, Data Science, Analytics"
Senior Software Developer,Staples,"Richmond Hill, ON",https://www.workopolis.com/jobsearch/viewjob/ciKlam4B0pBJCvux9AooaMNICs6MOxIkTqvC1PW---JiNc1dSbqIfKCgVnu2oKFM,
"AEM UI Developer - React.js , jQuery - 10yers Experience",Atlantis IT group,"Toronto, ON",https://www.workopolis.com/jobsearch/viewjob/qC2X5FynUFl-GRu0cygI5_-5XyryF0iHdwhkg3pq-a6dw7EmWtx4sAPbYsPz9GwU,"Web accessibility, Node.js, CSS, Bootstrap, React, Web development, XML, DevOps, Git, Analysis skills, JAWS, JavaScript, Requirements analysis, SASS, REST, Angular, APIs, Adobe Experience Manager, Agile, Adobe Marketing, UI, JSON, Unit testing, NVDA, Jenkins, TypeScript, Communication skills, jQuery, HTML5"
Senior Full Stack Developer,Intuit,"Toronto, ON",https://www.workopolis.com/jobsearch/viewjob/fV13wp_5pe1l2yIpzNwp9xe46DeQvviv-IqmRhjPek-OX_IUZaLhZkTYfnTiuybd,"Spring Boot, Computer Science, React, Full-stack development, Big data, Test-driven development, Java, Master's degree, Bachelor's, JavaScript, Scrum, Software development, Agile, Unit testing, SDLC"
Senior PHP Developer,Software International,"Toronto, ON",https://www.workopolis.com/jobsearch/viewjob/pTRmZ5AXekHkcWLBXFnFoHxPtBnYRRW6vWfm5qrVMJWcuOy_mkMzu6AvP-Hj_uFX,"Elasticsearch, System administration, CSS, React, Laravel, Git, English, Microservices, PHP, OOP, AWS, JavaScript, RabbitMQ, REST, Symfony, APIs, Linux, JSON, Communication skills, HTML5, MySQL"
Team Lead - Software Development,Staples,"Richmond Hill, ON",https://www.workopolis.com/jobsearch/viewjob/NdDxrusBaf7Yf2Rj4Oj_op3GNmU5dgXp-GkwqdylKfRe6xzEv_YBve7IUNmJfdTq,
Full Stack Web Developer,ActivateIT,"Greater Toronto Area, ON",https://www.workopolis.com/jobsearch/viewjob/TXMpqrTApBaag5KD1EXEm0Uzqr00BHLXow18Bdccqr1-D9LUMi0r5bEWhH9JGEQ7,"Web accessibility, Computer Science, CSS, Software Engineering, Bootstrap, React, WordPress, XML, Engineering, Post-secondary education, UNIX, PHP, JavaScript, Angular, APIs, JSON, jQuery, Debugging, HTML5, MySQL"
Senior Full Stack Developer,Talcura Technologies Inc.,"Toronto, ON",https://www.workopolis.com/jobsearch/viewjob/Kjbk0QGYRP41Ti9_PXr-6vo3AohDU9VB2RZFZxVj5mz-IPUhQFTZuzV1clrUdIXr,"Authentication, AJAX, Azure, MVC, Computer Science, CSS, Software Engineering, React, Engineering, .NET Core, Visual Studio, C#, Git, .NET, SQL, Bachelor's, SVN, REST, Angular, Software development, APIs, JSON, TFS, PowerShell, Active Directory, HTML5, Analytics, Design patterns"
